Stage of disposition,All C Number,All C Percent,CA Number,CA Percent,CB Number,CB Percent,CC Number,CC Percent,CD Number,CD Percent,CE Number,CE Percent,CP Number,CP Percent
Total number of cases closed,16360,100.0,10824,100.0,3195,100.0,1365,100.0,492,100.0,53,100.0,431,100.0
Before issuance of complaint,13925,85.1,8940,82.6,2928,91.6,1149,84.2,492,100.0,43,81.1,373,86.5
"After issuance of complaint, before opening of hearing",1172,7.1,821,7.6,127,4.0,114,8.3,0,0,5,9.4,25,5.8
"After hearing opened, before issuance of trial examiner's decision",115,0.7,94,0.9,13,0.4,6,0.4,0,0,0,0,2,0.5
"After trial examiner's decision, before issuance of Board decision",153,0.9,122,1.1,14,0.4,16,1.2,0,0,0,0,1,0.2
After Board order adopting trial examiner's decision in absence of exceptions,100,0.6,,,,,,,,,,,,
"After Board decision, before circuit court decree",554,3.4,432,4.0,70,2.2,39,2.9,0,0,0,0,13,3.0
"After circuit court of appeals decree, before Supreme Court action",273,1.7,196,1.8,29,0.9,27,2.0,0,0,4,7.5,10,2.3
After Supreme Court action,39,0.2,,,,,,,0,0,,,,
