row_label,col_1,col_2,col_3,col_4,col_5,col_6,col_7,col_8,col_9,col_10
Total number of cases closed,5802,100.0,4601,100.0,201,100.0,1000,100.0,85,100.0
Before issuance of notice of hearing,1834,31.6,1184,25.7,103,51.2,547,54.7,69,81.2
"After issuance of notice, before close of hearing",3149,54.3,2698,58.6,78,388,373,37.3,5,5.9
"After hears% closed, before issuance of decision",62,1.1,53,1.2,3,1.5,6,0.6,0,
After issuance of Regional Director's decision,757,13.0,666,14.5,17,8.5,74,7.4,11,12.9
After issuance of Board decision,0,,0,,0,,0,,0,
