row_label,col_1,col_2,col_3,col_4,col_5,col_6,col_7,col_8,col_9,col_10,col_11,col_12,col_13,col_14,col_15,col_16
Total number of cases closed………………,29741,100.0,22966,100.0,5848,100.0,570,100.0,168,100.0,60,100.0,49,100.0,80,100.0
Before issuance of complaint…………………….,25865,87.0,19587,85.3,5491,93.9,466,81.8,165,98.2,34,56.7,45,91.8,77,96.3
"After issuance of complaint, before opening of hearing………………………………………...",2849,9.6,2459,10.7,272,4.7,85,14.9,3,1.8,23,38.3,4,8.2,3,3.8
"After hearing opened, before issuance of administrative law judge's decision …………...",184,0.6,148,0.6,35,0.6,1,0.2,0,,0,,0,,0,
"After administrative law judge's decision, before issuance of Board decision……………………",22,0.1,19,0.1,2,0.0,1,0.2,0,,0,,0,,0,
After Board order adopting administrative law judge's decision in absence of exceptions …….,568,1.9,510,2.2,39,0.7,16,2.8,0,,3,5.0,0,,0,
"After Board decision, before circuit court decree ..",5,0.0,5,0.0,0,,0,,0,,0,,0,,0,
"After circuit court decree, before Supreme Court action…………………………………………..",247,0.8,237,1.0,9,0.2,1,0.2,0,,0,,0,,0,
After Supreme Court action………………………,1,0.0,1,0.0,0,,0,,0,,0,,0,,0,
