Stage of disposition,All R cases 1 / Number of cases,All R cases 1 / Percent of cases closed,RC cases 1 / Number of cases,RC cases 1 / Percent of cases closed,RM cases 1 / Number of cases,RM cases 1 / Percent of cases closed,RD cases 1 / Number of cases,RD cases 1 / Percent of cases closed
Total number of cases closed,8070,100.0,7093,100.0,602,100.0,375,100.0
Before issuance of notice of hearing,4169,51.7,3666,51.7,322,53.5,181,48.3
"After issuance of notice of hearing, before opening of hearing",1851,22.9,1626,22.9,140,23.2,85,22.7
"After hearing opened, before issuance of Board decision",315,3.9,282,4.0,19,3.2,14,3.7
After issuance of Board decision,1735,21.5,1519,21.4,121,20.1,95,25.3
