Type,Objections filed,Objections withdrawn,Objections ruled upon,Overruled / Number,Overruled / Percent of total ruled upon,Sustained / Number,Sustained / Percent of total ruled upon
All representation elections,270,106,164,131,79.9,33,20.1
By type of case: RC cases,241,91,150,120,80.0,30,20.0
By type of case: RM cases,7,3,4,2,50.0,2,50.0
By type of case: RD cases,22,12,10,9,90.0,1,10.0
By type of election: Consent elections,0,0,0,0,,0,
By type of election: Stipulated elections,192,78,114,93,81.6,21,18.4
By type of election: Expedited elections,2,2,0,0,,0,
By type of election: Regional Director-directed elections,75,25,50,38,76.0,12,24.0
By type of election: Board-directed elections,1,1,0,0,,0,
